{
  "schema": "a5cforge/v1",
  "kind": "comment.redacted",
  "id": "evt_issue1_comment1_redacted_0003",
  "time": "2025-12-19T14:33:00Z",
  "actor": "carol",
  "payload": {
    "entity": { "type": "issue", "id": "issue-1" },
    "commentId": "c-issue1-1",
    "reason": "Demonstrate redaction lifecycle in fixtures."
  }
}


