{
  "schema": "a5cforge/v1",
  "kind": "issue.event.created",
  "id": "evt_issue1_created_0001",
  "time": "2025-12-19T14:30:00Z",
  "actor": "alice",
  "payload": {
    "issueId": "issue-1",
    "title": "First issue",
    "body": "This is the first issue in the repo-basic fixture.",
    "state": "open"
  }
}


