{
  "schema": "a5cforge/v1",
  "kind": "pr.proposal.created",
  "id": "evt_pr1_proposal_inbox_a_0002",
  "time": "2025-12-19T14:41:00Z",
  "actor": "alice",
  "payload": {
    "prKey": "pr-1",
    "baseRef": "refs/heads/main",
    "headRef": "refs/heads/feature-a",
    "title": "Proposal A for pr-1",
    "body": "Inbox A proposal."
  }
}


