{
  "schema": "a5cforge/v1",
  "kind": "pr.proposal.created",
  "id": "evt_pr1_proposal_0001",
  "time": "2025-12-19T14:40:00Z",
  "actor": "alice",
  "payload": {
    "prKey": "pr-1",
    "baseRef": "refs/heads/main",
    "headRef": "refs/heads/feature-x",
    "title": "Add feature-x",
    "body": "PR proposal in repo-basic."
  }
}


