{
  "schema": "a5cforge/v1",
  "kind": "run.dispatched",
  "id": "evt_run_001_0001",
  "time": "2025-12-26T00:00:00.000Z",
  "actor": "tester",
  "payload": {
    "run_id": "run_001",
    "playbook": {
      "path": "playbooks/web_feature.yaml",
      "version": "v1"
    },
    "template_patch": {
      "cbp": [
        {
          "id": "pause_on_high_reward",
          "scope": "step",
          "step_id": 4,
          "when": "state.reward.latest.reward_total >= 0.85",
          "message": "High reward achieved â€” pause for sign-off"
        }
      ]
    }
  }
}

